{
  "schema_version": 1,
  "id": "synthetic-affine",
  "version": "1.0.0",
  "revision": "sha256:56f731422c39f2576a74604122b4ddb14bb4d86869e0011750e17b1196deb765",
  "provider": "onnx-synthetic-v1",
  "kind": "runtime_diagnostic",
  "developer": "Project VTuber synthetic fixture",
  "official_source": "https://github.com/Raccoon26/Project-VTuber",
  "download_url": null,
  "format": "onnx",
  "bytes": 216,
  "sha256": "56f731422c39f2576a74604122b4ddb14bb4d86869e0011750e17b1196deb765",
  "code_license": "project-owned",
  "weights_license": "CC0-1.0",
  "dependency_licenses": [
    "MIT",
    "Apache-2.0",
    "BSD-3-Clause",
    "BSD-2-Clause",
    "0BSD",
    "Zlib",
    "CC0-1.0",
    "Intel-Simplified",
    "MPL-2.0",
    "GPL-3.0-with-GCC-exception"
  ],
  "license_review": "approved",
  "commercial_use": true,
  "redistribution": true,
  "allowed_regions": ["*"],
  "output_restrictions": "Diagnostic numeric output only; no character-analysis claim",
  "runtime": "onnx-cpu-win-py312-v1",
  "backends": ["onnx_cpu"],
  "ram_mib": 512,
  "vram_mib": 0,
  "disk_mib": 512,
  "input": "float32[1,3] synthetic vector",
  "output": "float32[1,2] relu affine result",
  "preprocessing": "none; original images are not read",
  "verified_hardware": [],
  "evidence": ["scripts/generate-runtime-model.py"],
  "network_during_inference": false
}
